{
  "$schema": "https://json-schema.org/draft/2020-12/schema",
  "$id": "https://courtumpire.com/schemas/courtumpire-weekly-v1.json",
  "type": "object",
  "properties": {
    "schemaVersion": {
      "const": "courtumpire-weekly/v1"
    },
    "id": {
      "type": "string",
      "pattern": "^cu-weekly-\\d{4}-\\d{2}-\\d{2}$"
    },
    "slug": {
      "type": "string",
      "maxLength": 120,
      "pattern": "^\\d{4}-\\d{2}-\\d{2}-[a-z0-9]+(?:-[a-z0-9]+)*$"
    },
    "editionNumber": {
      "anyOf": [
        {
          "type": "integer",
          "minimum": 1
        },
        {
          "type": "null"
        }
      ]
    },
    "status": {
      "enum": [
        "draft",
        "published"
      ]
    },
    "title": {
      "type": "string",
      "minLength": 1,
      "maxLength": 180
    },
    "deck": {
      "type": "string",
      "minLength": 1,
      "maxLength": 500
    },
    "language": {
      "const": "en"
    },
    "timezone": {
      "const": "Europe/Berlin"
    },
    "issueDate": {
      "type": "string",
      "pattern": "^\\d{4}-\\d{2}-\\d{2}$"
    },
    "coverageStart": {
      "type": "string",
      "pattern": "^\\d{4}-\\d{2}-\\d{2}T\\d{2}:\\d{2}:\\d{2}(?:\\.\\d{1,3})?(?:Z|[+-]\\d{2}:\\d{2})$"
    },
    "coverageEnd": {
      "type": "string",
      "pattern": "^\\d{4}-\\d{2}-\\d{2}T\\d{2}:\\d{2}:\\d{2}(?:\\.\\d{1,3})?(?:Z|[+-]\\d{2}:\\d{2})$"
    },
    "plannedCutoff": {
      "type": "string",
      "pattern": "^\\d{4}-\\d{2}-\\d{2}T\\d{2}:\\d{2}:\\d{2}(?:\\.\\d{1,3})?(?:Z|[+-]\\d{2}:\\d{2})$"
    },
    "factsCheckedAt": {
      "type": "string",
      "pattern": "^\\d{4}-\\d{2}-\\d{2}T\\d{2}:\\d{2}:\\d{2}(?:\\.\\d{1,3})?(?:Z|[+-]\\d{2}:\\d{2})$"
    },
    "publishedAt": {
      "anyOf": [
        {
          "type": "string",
          "pattern": "^\\d{4}-\\d{2}-\\d{2}T\\d{2}:\\d{2}:\\d{2}(?:\\.\\d{1,3})?(?:Z|[+-]\\d{2}:\\d{2})$"
        },
        {
          "type": "null"
        }
      ]
    },
    "updatedAt": {
      "anyOf": [
        {
          "type": "string",
          "pattern": "^\\d{4}-\\d{2}-\\d{2}T\\d{2}:\\d{2}:\\d{2}(?:\\.\\d{1,3})?(?:Z|[+-]\\d{2}:\\d{2})$"
        },
        {
          "type": "null"
        }
      ]
    },
    "authorLabel": {
      "type": "string",
      "minLength": 1,
      "maxLength": 100
    },
    "aiAssisted": {
      "type": "boolean"
    },
    "seoDescription": {
      "type": "string",
      "minLength": 1,
      "maxLength": 300
    },
    "tags": {
      "type": "array",
      "items": {
        "type": "string",
        "minLength": 1,
        "maxLength": 40
      },
      "maxItems": 12
    },
    "commentsEnabled": {
      "type": "boolean"
    },
    "reactionsEnabled": {
      "type": "boolean"
    },
    "sources": {
      "type": "array",
      "items": {
        "type": "object",
        "properties": {
          "id": {
            "type": "string",
            "pattern": "^[a-z][a-z0-9-]{0,79}$"
          },
          "title": {
            "type": "string",
            "minLength": 1,
            "maxLength": 300
          },
          "publisher": {
            "type": "string",
            "minLength": 1,
            "maxLength": 150
          },
          "url": {
            "type": "string",
            "maxLength": 2000,
            "pattern": "^https://[^\\s]+$"
          },
          "publishedAt": {
            "anyOf": [
              {
                "anyOf": [
                  {
                    "type": "string",
                    "pattern": "^\\d{4}-\\d{2}-\\d{2}$"
                  },
                  {
                    "type": "string",
                    "pattern": "^\\d{4}-\\d{2}-\\d{2}T\\d{2}:\\d{2}:\\d{2}(?:\\.\\d{1,3})?(?:Z|[+-]\\d{2}:\\d{2})$"
                  }
                ]
              },
              {
                "type": "null"
              }
            ]
          },
          "accessedAt": {
            "type": "string",
            "pattern": "^\\d{4}-\\d{2}-\\d{2}T\\d{2}:\\d{2}:\\d{2}(?:\\.\\d{1,3})?(?:Z|[+-]\\d{2}:\\d{2})$"
          }
        },
        "required": [
          "id",
          "title",
          "publisher",
          "url",
          "publishedAt",
          "accessedAt"
        ],
        "additionalProperties": false
      },
      "maxItems": 100
    },
    "sections": {
      "type": "array",
      "items": {
        "type": "object",
        "properties": {
          "id": {
            "enum": [
              "last-week",
              "opening",
              "at-a-glance",
              "turning-point",
              "results",
              "rankings",
              "player-watch",
              "incidents",
              "watch",
              "this-weekend",
              "next-week"
            ]
          },
          "heading": {
            "type": "string",
            "minLength": 1,
            "maxLength": 200
          },
          "paragraphs": {
            "type": "array",
            "items": {
              "type": "object",
              "properties": {
                "text": {
                  "type": "string",
                  "minLength": 1,
                  "maxLength": 4000
                },
                "kind": {
                  "enum": [
                    "fact",
                    "analysis",
                    "editorial"
                  ]
                },
                "sourceIds": {
                  "type": "array",
                  "items": {
                    "type": "string",
                    "pattern": "^[a-z][a-z0-9-]{0,79}$"
                  },
                  "maxItems": 30
                }
              },
              "required": [
                "text",
                "kind",
                "sourceIds"
              ],
              "additionalProperties": false
            },
            "maxItems": 30
          },
          "tables": {
            "type": "array",
            "items": {
              "type": "object",
              "properties": {
                "id": {
                  "type": "string",
                  "pattern": "^[a-z][a-z0-9-]{0,79}$"
                },
                "variant": {
                  "enum": [
                    "results",
                    "rankings",
                    "player-updates",
                    "schedule",
                    "general"
                  ]
                },
                "caption": {
                  "type": "string",
                  "minLength": 1,
                  "maxLength": 400
                },
                "scope": {
                  "type": "string",
                  "minLength": 1,
                  "maxLength": 400
                },
                "asOf": {
                  "anyOf": [
                    {
                      "type": "string",
                      "pattern": "^\\d{4}-\\d{2}-\\d{2}$"
                    },
                    {
                      "type": "null"
                    }
                  ]
                },
                "columns": {
                  "type": "array",
                  "items": {
                    "type": "object",
                    "properties": {
                      "key": {
                        "type": "string",
                        "pattern": "^[a-z][a-z0-9-]{0,79}$"
                      },
                      "label": {
                        "type": "string",
                        "minLength": 1,
                        "maxLength": 80
                      }
                    },
                    "required": [
                      "key",
                      "label"
                    ],
                    "additionalProperties": false
                  },
                  "maxItems": 12,
                  "minItems": 1
                },
                "rows": {
                  "type": "array",
                  "items": {
                    "type": "object",
                    "properties": {
                      "cells": {
                        "type": "object",
                        "additionalProperties": {
                          "type": "string",
                          "minLength": 1,
                          "maxLength": 500
                        }
                      },
                      "sourceIds": {
                        "type": "array",
                        "items": {
                          "type": "string",
                          "pattern": "^[a-z][a-z0-9-]{0,79}$"
                        },
                        "maxItems": 30
                      }
                    },
                    "required": [
                      "cells",
                      "sourceIds"
                    ],
                    "additionalProperties": false
                  },
                  "maxItems": 1500
                },
                "sourceIds": {
                  "type": "array",
                  "items": {
                    "type": "string",
                    "pattern": "^[a-z][a-z0-9-]{0,79}$"
                  },
                  "maxItems": 30
                },
                "note": {
                  "anyOf": [
                    {
                      "type": "string",
                      "minLength": 1,
                      "maxLength": 4000
                    },
                    {
                      "type": "null"
                    }
                  ]
                }
              },
              "required": [
                "id",
                "variant",
                "caption",
                "scope",
                "asOf",
                "columns",
                "rows",
                "sourceIds",
                "note"
              ],
              "additionalProperties": false
            },
            "maxItems": 10
          },
          "timeline": {
            "type": "array",
            "items": {
              "type": "object",
              "properties": {
                "label": {
                  "type": "string",
                  "minLength": 1,
                  "maxLength": 150
                },
                "text": {
                  "type": "string",
                  "minLength": 1,
                  "maxLength": 4000
                },
                "sourceIds": {
                  "type": "array",
                  "items": {
                    "type": "string",
                    "pattern": "^[a-z][a-z0-9-]{0,79}$"
                  },
                  "maxItems": 30
                }
              },
              "required": [
                "label",
                "text",
                "sourceIds"
              ],
              "additionalProperties": false
            },
            "maxItems": 5
          },
          "reveal": {
            "anyOf": [
              {
                "type": "object",
                "properties": {
                  "label": {
                    "type": "string",
                    "minLength": 1,
                    "maxLength": 150
                  },
                  "question": {
                    "type": "string",
                    "minLength": 1,
                    "maxLength": 500
                  },
                  "options": {
                    "type": "array",
                    "items": {
                      "type": "object",
                      "properties": {
                        "id": {
                          "type": "string",
                          "pattern": "^[a-z][a-z0-9-]{0,79}$"
                        },
                        "text": {
                          "type": "string",
                          "minLength": 1,
                          "maxLength": 500
                        }
                      },
                      "required": [
                        "id",
                        "text"
                      ],
                      "additionalProperties": false
                    },
                    "maxItems": 4,
                    "minItems": 2
                  },
                  "answerOptionId": {
                    "type": "string",
                    "pattern": "^[a-z][a-z0-9-]{0,79}$"
                  },
                  "explanation": {
                    "type": "string",
                    "minLength": 1,
                    "maxLength": 4000
                  },
                  "sourceIds": {
                    "type": "array",
                    "items": {
                      "type": "string",
                      "pattern": "^[a-z][a-z0-9-]{0,79}$"
                    },
                    "maxItems": 30
                  }
                },
                "required": [
                  "label",
                  "question",
                  "options",
                  "answerOptionId",
                  "explanation",
                  "sourceIds"
                ],
                "additionalProperties": false
              },
              {
                "type": "null"
              }
            ]
          },
          "videos": {
            "type": "array",
            "items": {
              "type": "object",
              "properties": {
                "title": {
                  "type": "string",
                  "minLength": 1,
                  "maxLength": 250
                },
                "url": {
                  "type": "string",
                  "maxLength": 2000,
                  "pattern": "^https://[^\\s]+$"
                },
                "provider": {
                  "enum": [
                    "youtube",
                    "external"
                  ]
                },
                "channel": {
                  "type": "string",
                  "minLength": 1,
                  "maxLength": 150
                },
                "publishedAt": {
                  "anyOf": [
                    {
                      "anyOf": [
                        {
                          "type": "string",
                          "pattern": "^\\d{4}-\\d{2}-\\d{2}$"
                        },
                        {
                          "type": "string",
                          "pattern": "^\\d{4}-\\d{2}-\\d{2}T\\d{2}:\\d{2}:\\d{2}(?:\\.\\d{1,3})?(?:Z|[+-]\\d{2}:\\d{2})$"
                        }
                      ]
                    },
                    {
                      "type": "null"
                    }
                  ]
                },
                "embedAllowed": {
                  "type": "boolean"
                },
                "rightsStatus": {
                  "enum": [
                    "verified-official-embed",
                    "owned",
                    "licensed",
                    "link-only"
                  ]
                },
                "rightsNote": {
                  "type": "string",
                  "minLength": 1,
                  "maxLength": 1000
                },
                "sourceIds": {
                  "type": "array",
                  "items": {
                    "type": "string",
                    "pattern": "^[a-z][a-z0-9-]{0,79}$"
                  },
                  "maxItems": 30
                }
              },
              "required": [
                "title",
                "url",
                "provider",
                "channel",
                "publishedAt",
                "embedAllowed",
                "rightsStatus",
                "rightsNote",
                "sourceIds"
              ],
              "additionalProperties": false
            },
            "maxItems": 5
          }
        },
        "required": [
          "id",
          "heading",
          "paragraphs",
          "tables",
          "timeline",
          "reveal",
          "videos"
        ],
        "additionalProperties": false
      },
      "maxItems": 12,
      "minItems": 6
    },
    "corrections": {
      "type": "array",
      "items": {
        "type": "object",
        "properties": {
          "at": {
            "type": "string",
            "pattern": "^\\d{4}-\\d{2}-\\d{2}T\\d{2}:\\d{2}:\\d{2}(?:\\.\\d{1,3})?(?:Z|[+-]\\d{2}:\\d{2})$"
          },
          "note": {
            "type": "string",
            "minLength": 1,
            "maxLength": 4000
          },
          "sourceIds": {
            "type": "array",
            "items": {
              "type": "string",
              "pattern": "^[a-z][a-z0-9-]{0,79}$"
            },
            "maxItems": 30
          }
        },
        "required": [
          "at",
          "note",
          "sourceIds"
        ],
        "additionalProperties": false
      },
      "maxItems": 50
    }
  },
  "required": [
    "schemaVersion",
    "id",
    "slug",
    "editionNumber",
    "status",
    "title",
    "deck",
    "language",
    "timezone",
    "issueDate",
    "coverageStart",
    "coverageEnd",
    "plannedCutoff",
    "factsCheckedAt",
    "publishedAt",
    "updatedAt",
    "authorLabel",
    "aiAssisted",
    "seoDescription",
    "tags",
    "commentsEnabled",
    "reactionsEnabled",
    "sources",
    "sections",
    "corrections"
  ],
  "additionalProperties": false
}
